{
  "schema_version": "1.0.0",
  "agent_version": "1.0.0",
  "rules_compiled": [
    "[README.md] # ðŸš€ Claude Project Init Kit  ## ðŸ“‹ **Resumen**  El **Claude Project Init Kit** es un sistema avanzado de inicializaciÃ³n de proyectos que integra Claude Code con herramientas especializadas para crear proyectos de alta calidad de forma sistemÃ¡tica y eficiente."
  ],
  "violations": [],
  "advice": [
    "tone:neutral",
    "domain:general",
    "Ensure primary policies are acknowledged."
  ],
  "trace": [
    "rules.server:ok"
  ]
}
